attribute_name,description,category
documentation:view,View document list and download documents,action
documentation:upload,Upload new documents,action
documentation:delete,Delete documents,action
documentation:chat,Use AI chat for document Q&A,action
documentation:search,Use smart search across documents,action
documentation:retry,Retry failed document conversions,action
documentation:manage-orphans,Delete orphaned documents from KB,action
documentation:view-stats,View document stats and sync status,action
documentation:view-ingestion,Check knowledge base ingestion job status,action
